{
  "schema_version": "1.0.0",
  "id": "numbered_topic_bullets",
  "name": "短段落按主旨句和编号分点保真拆解",
  "category": "content",
  "priority": 90,
  "match": {
    "all": ["has_numbered_paragraph", "has_short_numbered_paragraph"],
    "any": [],
    "none": []
  },
  "guidance": {
    "applicable_when": [
      "段落第一句为完整主旨句",
      "后续内容包含1）2）3）等编号分点",
      "文本较短且原文表达完整"
    ],
    "recommended": [
      "key_message保留第一句原文",
      "编号分点按原顺序拆为bullets",
      "短文本优先完整保留业务主体和限定信息"
    ],
    "avoid": [
      "不得把多个编号业务合并为一句抽象总结",
      "不得输出由关键词机械拼接而成的残句"
    ]
  },
  "example": {
    "input": {
      "section_title": "1.1 国家网信行业“国家队”，公网通信等领域深度布局",
      "paragraph": "中电科普天科技股份有限公司是中国电子科技集团有限公司控制的国有控股上市企业，以信息通信领域为核心战略布局新兴产业领域。1）公网通信业务，包括通信信息技术服务、通信网络产品等业务。2）专网通信与智慧应用业务，包括专网通信、智慧通信等业务。3）智能制造业务，包括印制电路板、时频器件等业务。"
    },
    "expected": {
      "title": "1.1 国家网信行业“国家队”，公网通信等领域深度布局",
      "key_message": "中电科普天科技股份有限公司是中国电子科技集团有限公司控制的国有控股上市企业，以信息通信领域为核心战略布局新兴产业领域。",
      "bullet_points": [
        "公网通信业务，包括通信信息技术服务、通信网络产品等业务。",
        "专网通信与智慧应用业务，包括专网通信、智慧通信等业务。",
        "智能制造业务，包括印制电路板、时频器件等业务。"
      ]
    }
  }
}
